Date,Image_URL,Likes_Count,Title
"January 14, 2020",https://rategain.com/blog/why-ux-is-instrumental-for-revenue-management/,12,Why UX is Instrumental for Revenue Management
"December 17, 2019",https://rategain.com/blog/visualizing-data-like-a-pro-the-key-to-unlock-the-data-gold-mine/,9,Visualizing Data Like a Pro: The Key to Unlock the Data Gold Mine
"December 4, 2019",https://rategain.com/blog/smart-shopping-for-data-driving-analytics-excellence-in-the-airlines-industry/,2,Smart Shopping for Data: Driving Analytics Excellence in the Airlines Industry
"November 29, 2019",https://rategain.com/blog/mr-hotelier-four-signs-it-is-time-to-change-your-distribution-partner/,1,"Mr. Hotelier, Four Signs It is Time to Change your Distribution Partner"
"November 22, 2019",https://rategain.com/blog/adopting-scrum-organization-people-processes/,0,Adopting SCRUM in the Organization’s People Processes
"November 19, 2019",https://rategain.com/blog/how-to-deliver-value-in-the-era-of-hospitality-industry-consolidation/,0,How to Deliver Value In The Era Of Hospitality Industry Consolidation?
"November 11, 2019",https://rategain.com/blog/what-will-define-long-term-success-for-airlines/,5,What will define Long Term Success for Airlines
"October 23, 2019",https://rategain.com/blog/challenges-for-airline-revenue-managers-beyond-2020/,5,Challenges for Airline Revenue Managers Beyond 2020
"October 21, 2019",https://rategain.com/blog/navigating-constant-consolidation/,5,Navigating Constant Consolidation
"October 17, 2019",https://rategain.com/blog/our-point-of-view-on-distribution-journey/,5,Our point of view on Distribution Journey
"October 15, 2019",https://rategain.com/blog/putting-user-experience-at-the-center-of-a-new-problem/,7,Putting User Experience at the center of a new problem
"October 15, 2019",https://rategain.com/blog/re-configuring-the-distribution-models-for-the-next-gen-distribution-ecosystem/,0,The Last Distribution Challenge
"October 4, 2019",https://rategain.com/blog/can-car-rental-analytics-help-make-better-investment-decisions/,5,Can Car Rental analytics help make better investment decisions?
"September 21, 2019",https://rategain.com/blog/top-three-considerations-for-blueprinting-your-content-transformation/,5,Top 3 considerations for blueprinting your content transformation
"September 11, 2019",https://rategain.com/blog/how-to-turn-around-car-industry-slowdown/,5,The Path to A Shared Future: Can car rentals help in turning around the industry slowdown ?
"August 21, 2019",https://rategain.com/blog/delivering-duty-of-care-in-the-age-of-corporate-rogue-travel/,4,Delivering Duty of Care in the Age of Corporate Rogue Travel
"July 22, 2019",https://rategain.com/blog/who-is-winning-the-experience-game-in-travel-and-hospitality/,1,Who is winning the experience game in travel and hospitality?
"July 18, 2019",https://rategain.com/blog/airlines-soaring-on-ancillary-revenue/,1,Airlines: Soaring on Ancillary Revenue
"June 24, 2019",https://rategain.com/blog/transaction-tracking-and-analytics-steering-car-rental/,0,Transaction Tracking and Analytics: Steering Car Rental
"June 24, 2019",https://rategain.com/blog/enhancing-car-rental-revenue-management-with-ai-driven-dynamic-pricing/,0,Enhancing Car Rental Revenue Management with AI-driven Dynamic Pricing
"February 8, 2019",https://rategain.com/blog/busting-billion-dollar-digital-myth-cruise-lines/,1,Busting a billion-dollar digital myth for cruise lines!
"September 24, 2018",https://rategain.com/blog/future-distribution-strategy-doorstep/,0,The future of distribution strategy at your doorstep
"August 27, 2018",https://rategain.com/blog/importance-picture-reviews-hotel-reputation/,0,"‘A Thousand Words’: Why Great Visuals Speak Directly, Fluently and Effortlessly"
"August 24, 2018",https://rategain.com/blog/new-age-big-data-growth-package-providers/,0,New Age Data is Driving Growth for Travel Package Providers
"July 16, 2018",,0,Tackling content issues head-on
"July 13, 2018",https://rategain.com/blog/7-trends-hotel-distribution/,0,7 Top Trends In Hotel Distribution Today
"May 4, 2018",https://rategain.com/blog/channel-management-channel-management-hrs-selects-rategain-channel-management-partner-new-platform/,0,HRS Selects RateGain as its Channel Management Partner for their newest connectivity platform
"April 11, 2018",https://rategain.com/blog/code-itineraries-road-map-travel-industry/,0,Code Itineraries: A road map for the travel industry to unlock one trillion dollars in value by 2025
"April 9, 2018",https://rategain.com/blog/5-ways-improve-hotels-visibility-search-engines/,0,5 Ways to Improve Your Hotel's Visibility within Search Engines
"April 3, 2018",,0,Hitting a home run in automation tools
"January 22, 2018",,0,Tapping the world’s no. 1 outbound travel market
"January 11, 2018",https://rategain.com/blog/pure-adrenaline-distribution-strategy-studio/,0,It's 100% pure adrenaline! Introducing Distribution Strategy Studio
"December 11, 2017",https://rategain.com/blog/hotel-reputation-matters-revenue/,0,Your Hotel Reputation Matters to Your Revenue
"November 23, 2017",https://rategain.com/blog/hotel-parity-prevent-revenue-leakages/,0,"Hoteliers, Take a Re-look at Parity and Prevent Revenue Leakages"
"November 21, 2017",,0,Assessing the boom in travel startups
"April 21, 2020",https://rategain.com/blog/social-media-during-covid-19-tourism-brands-that-got-it-right/,2,Social Media During COVID-19: Tourism Brands That Got It Right
"March 20, 2020",https://rategain.com/blog/have-we-braced-ourselves/,6,We Are Bracing Ourselves: Are You?
"March 11, 2020",https://rategain.com/blog/how-to-capture-rate-integrity-issues-in-the-most-simplified-way/,4,How to Capture Rate Integrity Issues in the Most Simplified Way
"March 4, 2020",https://rategain.com/blog/top-3-rate-disparity-cases-acceptable-to-a-revenue-manager/,7,Top 3 Rate Disparity Cases Acceptable to a Revenue Manager
"February 27, 2020",https://rategain.com/blog/rate-integrity-a-brand-new-way-of-increasing-direct-bookings/,3,Rate Integrity: A Brand New Way of Increasing Direct Bookings
"February 19, 2020",https://rategain.com/blog/why-choose-rate-intelligence-over-rate-shopping/,5,Why Choose Rate Intelligence Over Rate Shopping?
"February 5, 2020",https://rategain.com/blog/why-a-rate-intelligence-experience-should-have-the-best-art-science-behind-it/,6,Why a Rate Intelligence Experience Should Have the Best Art & Science Behind it
"January 31, 2020",https://rategain.com/blog/our-point-of-view-on-the-modern-age-distribution-ecosystem/,1,Our Point of View on the Modern Age Distribution Ecosystem
"January 29, 2020",https://rategain.com/blog/are-you-leading-a-future-ready-hr/,3,Are You Leading A Future-Ready HR?
"July 22, 2020",https://rategain.com/blog/perspectives-with-debojo-how-survival-became-a-success-metric-at-spicejet/,1,Perspectives with Debojo: How Survival Became A Success Metric at SpiceJet
"July 20, 2020",https://rategain.com/blog/strategies-for-hoteliers-to-get-back-to-business-for-uk-market/,1,Strategies for Hoteliers to Get Back to Business for UK Market
"July 20, 2020",https://rategain.com/blog/strategies-for-hoteliers-to-get-back-to-business-for-europe-market/,4,Strategies for Hoteliers to Get Back to Business for Europe Market
"July 14, 2020",https://rategain.com/blog/perspectives-8-with-ajay-bakaya-managing-director-sarovar-hotels-and-resorts/,0,"Perspectives #8 with Ajay Bakaya, Managing Director, Sarovar Hotels and Resorts"
"June 30, 2020",https://rategain.com/blog/re-taking-the-skies-what-can-commercial-teams-do-to-gear-up-for-a-full-return-of-airline-travel-in-the-new-normal/,0,Re-Taking The Skies : What Can Commercial Teams Do To Gear Up For A Full Return Of Airline Travel In The New Normal
"June 15, 2020",https://rategain.com/blog/react-to-competitive-prices-in-real-time-with-rategains-optima-marketdrone/,0,React to Competitive Prices in Real Time with RateGain’s OPTIMA MarketDrone
"June 2, 2020",https://rategain.com/blog/watch-your-language-content-in-the-new-hospitality-landscape/,0,Watch Your Language! Content in the New Hospitality Landscape
"May 5, 2020",https://rategain.com/blog/keeping-lights-on-during-the-current-covid-crisis/,1,Keeping Lights on During the Current COVID Crisis!
"April 23, 2020",https://rategain.com/blog/hoteliers-spot-new-markets-to-create-new-revenues-in-a-post-covid-19-world/,7,"Hoteliers, Spot New Markets to Create New Revenues in a Post-COVID 19 World"
