Date,Image_URL,Likes_Count,Title
"September 22, 2023",https://rategain.com/blog/egypt-hotel-strategies/,1,Shaping Success in Egypt's Dynamic Hospitality Landscape: A Roadmap for Hoteliers
"September 15, 2023",https://rategain.com/blog/renewable-energy-in-hotels/,0,Checking In to a Greener Future: Renewable Energy in Hotels
"September 14, 2023",https://rategain.com/blog/role-of-travel-sellers-in-sustainable-tourism/,0,Sustaining Communities: The Role of Travel Sellers in Sustainable Tourism
"September 11, 2023",https://rategain.com/blog/water-conservation-in-hotels/,1,Flowing Towards Sustainability: Water Conservation in Hotels
"September 10, 2023",https://rategain.com/blog/eco-friendly-practices-in-vacation-rentals/,0,Eco-Friendly Practices in Vacation Rentals: A Win-Win for Guests and the Environment
"September 9, 2023",https://rategain.com/blog/zero-waste-travel/,0,Zero-Waste Travel: A Sustainable Path to Explore the World
"September 8, 2023",https://rategain.com/blog/sustainable-supply-chain-management-in-hotels/,0,Building a Greener Future: Sustainable Supply Chain Management in Hotels
"September 7, 2023",https://rategain.com/blog/airline-sustainability-initiatives/,0,Airline Sustainability Initiatives: How Airlines are Going Green
"September 6, 2023",https://rategain.com/blog/eco-tourism/,0,Exploring Eco-Tourism: Where Nature Meets Responsible Travel
"February 9, 2015",,1,Europe's Outlook for 2015: What it means for your Hotel
"February 6, 2015",,1,"RateGain Announces Merril Yu and Sunish Sadasivan as Hotel Revenue Summit, Manila Keynote Speakers"
"February 4, 2015",,1,"Join RateGain at Hotel Revenue Summit, Manila on February 12th, 2015"
"September 6, 2023",https://rategain.com/blog/sustainability-impact-for-hotels-and-travel-sellers/,0,Measuring and Reporting Sustainability Impact: Metrics for Hotels and Travel Sellers
"September 5, 2023",https://rategain.com/blog/sustainable-practices-for-tour-operators/,1,Reducing Carbon Footprint: Sustainable Practices for Tour Operators
"September 4, 2023",https://rategain.com/blog/biodiversity-conservation-in-travel/,0,Preserving Paradise: Biodiversity Conservation in Travel
"September 3, 2023",https://rategain.com/blog/how-green-is-your-hotel/,1,"How Green is your Hotel? Do Good and Show it to the World – on Google, for Example"
"September 1, 2023",https://rategain.com/blog/evolution-of-uk-hospitality/,1,The Digital Evolution of UK Hospitality: A Historic Journey From Keys to Clicks
"September 1, 2023",https://rategain.com/blog/future-of-sustainable-car-rentals/,0,Driving Green: The Future of Sustainable Car Rentals
"September 1, 2023",https://rategain.com/blog/sustainable-food-practices-in-hotels-and-restaurants/,0,Taste the Future: Sustainable Food Practices in Hotels and Restaurants
"September 1, 2023",https://rategain.com/blog/impact-of-dmo-on-local-economies/,0,The Heart of Travel: DMOs and Their Impact on Local Economies
"August 31, 2023",https://rategain.com/blog/the-world-is-coming-to-india-this-winters/,2,Exploring India's Travel Resurgence: From G20 Summit to Cricket Hype Amidst a High-Demand Festive Season
"July 18, 2023",https://rategain.com/blog/ideas-for-large-hotel-chains-for-success/,0,Large Hotel Chains Can Move Fast Too: 10 Ideas To Implement Today
"July 18, 2023",https://rategain.com/blog/basics-of-distribution-for-hotel-chains/,0,The Basics of Distribution for Hotel Chains
"July 18, 2023",https://rategain.com/blog/benefits-of-metasearch-marketing/,0,Supercharging Hotel Bookings: The Game-Changing Benefits of Metasearch Marketing
"July 17, 2023",https://rategain.com/blog/tech-stack-needed-by-otas/,0,The Tech-Stack Needed by OTAs to Scale Your BI Capabilities
"July 17, 2023",https://rategain.com/blog/future-of-rate-parity-in-the-hospitality-industry/,0,The Future of Rate Parity in the Hospitality Industry
"July 12, 2023",https://rategain.com/blog/hotel-pricing-ai/,0,How Hotel Pricing is Going to Change in the Age of AI
"July 10, 2023",https://rategain.com/blog/instagram-threads-for-travel-and-hospitality-and-travel-industry/,0,Leveraging Instagram Threads for the Travel and Hospitality Industry
"July 7, 2023",https://rategain.com/blog/ga4-for-hoteliers/,1,Calling All Hoteliers: Unleash the Power of GA4 for Optimal Performance
"July 3, 2023",https://rategain.com/blog/sustainable-hotels/,1,Green Gold: Sustainable Hotels Shaping Profitable and Responsible Hospitality
"August 21, 2023",https://rategain.com/blog/add-social-media-to-google-business-profile/,1,Social Media Meets Google Business Profile: Here's Why You Should Care
"August 18, 2023",https://rategain.com/blog/hotel-system-connectivity-challenges/,1,Connect the Dots: Decoding Common Hotel System Connectivity Challenges
"August 17, 2023",https://rategain.com/blog/ga4-user-data-export-to-big-query-for-hotels/,1,GA4's New User Data Export to BigQuery: Your Key to Hyper-Personalized Hotel Marketing
"August 16, 2023",https://rategain.com/blog/role-of-ai-ml-in-hotel-search-engines/,1,How AI and Machine Learning are Shaping Hotel Search Engines
"August 16, 2023",https://rategain.com/blog/global-dei-strategy/,1,Unpacking Global DE&I Pillars: A Strategy for Inclusivity
"August 15, 2023",https://rategain.com/blog/evolution-of-hotel-search-engines/,1,"The Evolution of Hotel Search Engines: Past, Present, and Future"
"August 14, 2023",https://rategain.com/blog/top-innovations-of-independent-india/,1,From Green Revolution to Space Exploration: 75 Innovations Propelling India Beyond 75
"August 10, 2023",https://rategain.com/blog/hotel-search-engines-promoting-sustainability/,1,Going Green: How Hotel Search Engines are Championing the Cause of Sustainable Travel
"August 9, 2023",https://rategain.com/blog/google-hotel-filtered-search-carousel/,1,Get Noticed: The Smart Hotelier's Guide to Google's Filtered Search Carousel
"August 9, 2023",https://rategain.com/blog/hotel-search-engines/,1,Understanding the Mechanics of Hotel Search Engines
"August 8, 2023",https://rategain.com/blog/hospitality-softwares/,1,Hospitality in the Digital Age: Software Breakthroughs and What's Next
"August 4, 2023",https://rategain.com/blog/gaining-a-competitive-edge-at-every-stage-of-the-traveler-journey/,1,Gaining a Competitive Edge at Every Stage of the Traveler Journey
"August 4, 2023",https://rategain.com/blog/hotel-revenue-management-analytics/,1,Elevate Your Hotel's Performance with Revenue Management Analytics
"August 4, 2023",https://rategain.com/blog/stay-competitive-in-hospitality-industry/,1,How Hotels Can Stay Ahead in the Dynamic Hospitality Industry
"August 1, 2023",https://rategain.com/blog/hospitality-management/,0,What is Hospitality Management? Why is it Important?
"August 1, 2023",https://rategain.com/blog/pop-icons-driving-travel-demand/,0,Has 'The Swiftie Fever' Opened New Travel Avenues In the U.S.
"July 21, 2023",https://rategain.com/blog/technology-partnerships-for-hotels/,0,How to Make Technology Partnerships Successful for Hotels
"July 20, 2023",https://rategain.com/blog/ai-and-ml-in-travel-industry/,0,AI and Machine Learning – Who Will Lead the Change and What Will it Look Like?
"June 28, 2023",https://rategain.com/blog/managing-hotel-cancellations/,0,Managing Hotel Cancellations: Strategies to Optimize Revenue and Guest Satisfaction
"June 27, 2023",https://rategain.com/blog/big-data-in-hospitality-industry/,0,Big Data: The Game Changer in Hospitality Industry
"June 26, 2023",https://rategain.com/blog/hotel-challenges/,0,Unveiling the Hotel Challenges: Navigating Obstacles in the Dynamic Hospitality Landscape
"June 23, 2023",https://rategain.com/blog/distribution-challenges-for-hotels-in-latin-america/,0,Distribution Challenges for Hotels in Latin America
"June 22, 2023",https://rategain.com/blog/solving-hotel-distribution-challenges-with-technology-and-strategy/,1,Navigating Hotel Distribution Challenges with Technology and Strategy
"June 20, 2023",https://rategain.com/blog/digital-foundation-in-hospitality/,0,What Does Digital Foundation in Hospitality Look Like
"June 13, 2023",https://rategain.com/blog/effective-hotel-pricing-strategies-during-low-demand-periods/,0,Effective Hotel Pricing Strategies To Maximize Revenue During Low Demand Periods
"June 12, 2023",https://rategain.com/blog/the-power-of-allyship/,0,The Power of Allyship: Building Bridges of Support and Inclusion
"June 11, 2023",https://rategain.com/blog/effective-hotel-revenue-management-strategies/,1,Mastering Success: Hotel Revenue Management Strategies for Optimal Growth
"June 15, 2016",https://rategain.com/blog/effective-ways-to-measure-generate-demand-part-iii/,0,Effective Ways to Measure & Generate Demand – Part III
"May 17, 2016",https://rategain.com/blog/effective-ways-to-measure-and-generate-demand-part-i/,0,Effective Ways to Measure and Generate Demand - Part I
"May 3, 2016",https://rategain.com/blog/8-top-tips-to-choose-the-right-hotel-channel-manager/,0,8 Top Tips to Choose the Right Hotel Channel Manager
"April 27, 2016",https://rategain.com/blog/comparing-and-contrasting-industry-problems-with-revenue-optimisation/,0,Comparing and Contrasting Industry Problems with Revenue Optimisation
"April 20, 2016",,0,"Making Cents of RevGain: An Interview With the Revenue Manager at St. George Lycabettus Hotel, Greece"
"April 19, 2016",,0,Tapping the potential of emerging markets
"April 14, 2016",https://rategain.com/blog/unity-for-revenue-management-an-interview-with-the-revenue-analyst-at-the-manila-hotel-philippines/,0,"Unity for Revenue Management: An Interview With the Revenue Analyst at The Manila Hotel, Philippines"
"April 6, 2016",https://rategain.com/blog/how-to-choose-the-right-rate-optimisation-tool-for-your-hotel/,0,How to Choose the Right Rate Optimisation Tool for Your Hotel?
"April 4, 2016",,0,New partnerships underscore benefits of DHISCO’s ‘direct-to-many’ solutions
"April 14, 2015",,0,Will airbnb disrupt the hotel business or just play on the sidelines?
"March 23, 2015",,0,3 Questions RateGain will Answer for you at WTM Latin America
"March 19, 2015",,0,5 Key Highlights of Super Successful RateGain’s Hotel Revenue Summit 2015 Jakarta
"March 10, 2015",,0,Reviews and Ratings: A simple way to use them to support your transient pricing strategy
"February 25, 2015",,0,ITB Berlin: 5 Steps to Making Your Visit a Success
"February 23, 2015",,0,Accor Hotels Partners with RateGain for its Rate Shopping Solution Integration
"February 19, 2015",,0,RateGain Bags Top Honour at The 2nd Inc. India Innovative100 Conference and Awards Gala
"February 12, 2015",,0,3 Reasons to visit RateGain at ITB Berlin
"February 12, 2015",,0,Top 3 Tips to Price Your Hotel Rooms Right in 2015
"March 21, 2016",https://rategain.com/blog/airbnb-an-alternate-lodging-threat-to-hotels/,0,Airbnb: An Alternate Lodging Threat to Hotels?
"March 9, 2016",,0,21 Points to Consider while Buying a Rate Shopping Tool for Your Hotel
"February 19, 2016",https://rategain.com/blog/critical-to-push-rates-along-with-occupancy/,0,Did You Know? It’s critical to Push Rates along with Occupancy
"February 12, 2016",https://rategain.com/blog/hotel-demand-forecasting-top-3-ways-hoteliers-can-leverage-this-strategic-management-tool/,0,Hotel Demand Forecasting: Top 3 Ways Hoteliers Can Leverage this Strategic Management Tool
"February 12, 2016",https://rategain.com/blog/7-quick-tips-for-your-hotel-pre-opening-in-2017/,0,7 Quick Tips For Your Hotel Pre-Opening In 2017
"February 8, 2016",https://rategain.com/blog/zika-virus-outbreak-impact-on-tourism-in-central-and-south-america/,0,Zika virus outbreak:  Is tourism industry in Central and South America on risk?
"January 27, 2016",,0,How to make 35% more revenue? Tap the power of Scientific Pricing
"January 8, 2016",,0,Want to Maximize Your Hotel Revenue? Get Your Room Forecast Accurate ASAP
"January 3, 2016",https://rategain.com/blog/9-undeniable-advantages-of-hotel-room-forecasting/,0,9 Undeniable Advantages of Hotel Room Forecasting
"December 15, 2015",https://rategain.com/blog/make-the-most-of-your-hotels-facebook-page/,0,Golden Rules to Make the Most of Your Hotel’s Facebook Page
"December 10, 2015",,0,DHISCO’s big data challenge
"October 23, 2015",https://rategain.com/blog/a-revenue-management-mistake-that-you-need-to-avoid-today/,0,A Revenue Management mistake that you need to avoid today
"October 19, 2015",https://rategain.com/blog/the-uk-revpar-growth-story-promises-and-challenges/,0,The UK RevPAR Growth Story: Promises and Challenges
"September 28, 2015",,0,August 2015: Parity Performance. Where Does Your City Stand? – Latin America
"September 18, 2015",,0,Introducing BrandGain Restaurant Module
"September 16, 2015",,0,"Q&A with new DHISCO CEO Toni Portmann, on taking Pegasus beyond the hotel switch"
"September 16, 2015",,0,Revenue optimisation love story: Grandhotel Zvon  achieves 34% growth in revenue with scientific pricing
"September 14, 2015",,0,Scientific pricing is no longer the Lamborghini you can never have.
"August 5, 2015",,0,"As other hotel distribution fees rise, DHISCO represents less than 1% of booking costs"
"July 21, 2015",,0,UNT Big Data Challenge
"July 16, 2015",https://rategain.com/blog/how-to-improve-your-hotels-online-reputation-using-a-100-year-old-mathematical-principle/,2,How to improve your hotel's online reputation using a 100 year old mathematics principle
"July 13, 2015",,0,Total Pricing
"June 12, 2015",,0,Update from HEDNA Barcelona: Forecast is sunny
"June 4, 2015",https://rategain.com/blog/revpar-growth-in-europe-the-top-three-cities/,0,RevPar Growth in Europe: The top three cities
"May 19, 2015",,0,The news for the hotel industry just keeps getting better
"April 29, 2015",https://rategain.com/blog/three-important-elements-your-revenue-management-system-is-missing/,0,Three important elements your Revenue Management system is missing
"April 21, 2015",,0,5 ways to Maximize Hotel Revenues in the Era of Mobile Bookings
"June 10, 2023",https://rategain.com/blog/solving-the-challenge-of-overbooking-in-hotels/,0,Solving the Challenge of Overbooking in Hotels: Strategies for Seamless Guest Experience
"June 9, 2023",https://rategain.com/blog/managing-hotel-demand-during-special-events/,0,Navigating the Highs and Lows: Managing Hotel Demand During Special Events
"June 9, 2023",https://rategain.com/blog/the-impact-of-weather-on-hotel-demand/,0,The Impact of Weather on Hotel Demand: Leveraging Insights for Success
"June 8, 2023",https://rategain.com/blog/google-marketing-live-ai-powered-innovations-for-the-hotel-industry/,0,Inside Google Marketing Live 2023: AI-Powered Innovations & What They Mean for the Hotel Industry
"June 8, 2023",https://rategain.com/blog/hotel-loyalty-programs/,0,Hotel Loyalty Programs: Building Customer Loyalty and Maximizing Rewards
"June 8, 2023",https://rategain.com/blog/the-impact-of-seasonality-on-hotel-revenue/,0,The Impact of Seasonality on Hotel Revenue: Understanding the Highs and Lows
"June 7, 2023",https://rategain.com/blog/walking-the-tight-rope-high-adr-and-low-distribution-cost/,0,Walking the Tight Rope: High Hotel ADR and Low Distribution Cost
"June 7, 2023",https://rategain.com/blog/managing-hotel-inventory-distribution-through-crs/,0,The Role of Central Reservation Systems in Efficient Hotel Inventory Distribution
"June 5, 2023",https://rategain.com/blog/the-history-of-pride-month/,0,The History of Pride Month: Celebrating Love and Equality
"June 5, 2023",https://rategain.com/blog/cloud-computing-for-hotels/,0,A Comprehensive Guide to Cloud Computing for Hotels: Transforming the Hospitality Industry
"June 1, 2023",https://rategain.com/blog/hotel-central-reservation-system/,0,Unlock the Power of a Hotel Central Reservation System
"May 26, 2023",https://rategain.com/blog/data-analytics-distribute-hotel-inventory-profitably/,0,Data and Analytics Can Help You Distribute Your Hotel Inventory Effectively & Run Hotel Profitably
"May 26, 2023",https://rategain.com/blog/hotel-data-analytics/,0,Data-Driven Excellence: Maximizing Performance with Hotel Data Analytics
"May 25, 2023",https://rategain.com/blog/driving-higher-hotel-occupancy-rates/,0,Driving Higher Hotel Occupancy Rates: Implementing Effective Strategies
"May 24, 2023",https://rategain.com/blog/the-complete-guide-to-hotel-digital-marketing/,0,The Complete Guide to Hotel Digital Marketing: Boost Your Online Presence and Drive Bookings
"May 23, 2023",https://rategain.com/blog/global-distribution-system/,1,What is a Global Distribution System (GDS)? How does it Benefit Your Hotel?
"May 23, 2023",https://rategain.com/blog/power-of-hotel-technology/,1,Unleashing the Power of Hotel Technology: The Game Changer in Tech-Savvy Hospitality
"May 23, 2023",https://rategain.com/blog/introduction-to-hotel-revenue-management/,0,Unlocking Profitability: An Introduction to Hotel Revenue Management
"May 14, 2023",https://rategain.com/blog/what-is-a-hotel-channel-manager/,0,What is a Hotel Channel Manager? How Do You Choose the Perfect One?
"May 13, 2023",https://rategain.com/blog/how-content-can-solve-the-expectation-gap-for-hotels/,0,How Can Content Solve The Expectation Gap for Hotels?
"May 11, 2023",https://rategain.com/blog/guest-behaviors-changing-booking-inspiration/,0,Changing Markets Post-Pandemic: Guest Behaviors Changing Booking Inspiration
"May 6, 2023",https://rategain.com/blog/hotel-occupancy-rate/,2,What is Hotel Occupancy Rate? How to Calculate it?
"May 5, 2023",https://rategain.com/blog/is-revpar-the-best-metric-to-measure-profitability/,0,Is RevPAR the Best Metric to Measure Profitability?
"May 5, 2023",https://rategain.com/blog/why-are-frequent-content-updates-important/,2,Why Should Hotels Update Content On OTAs Frequently?
"May 4, 2023",https://rategain.com/blog/why-metasearch-is-critical-for-your-direct-bookings-strategy/,0,Why Metasearch is critical for your Direct Bookings Strategy
"May 3, 2023",https://rategain.com/blog/why-content-on-otas-is-critical-for-improving-conversion-rates/,0,Why Content on OTAs is Critical for Improving Conversion Rates
"May 3, 2023",https://rategain.com/blog/how-hotels-distribute-inventory-to-drive-bookings/,0,How do Hotels Distribute Inventory to Drive Bookings
"May 22, 2023",https://rategain.com/blog/why-should-destinations-have-a-destination-marketing-organization/,0,Why Should All Destinations Have a Destination Marketing Organization (DMO)?
"May 22, 2023",https://rategain.com/blog/destination-marketing-guide/,0,"Destination Marketing Organization: Its Roles, Importance, and Benefits in the Hospitality Industry"
"May 22, 2023",https://rategain.com/blog/difference-between-a-hotel-pms-channel-manager-otas-and-booking-engine/,3,"Difference Between a Hotel PMS, Channel Manager, OTAs, and Booking Engine"
"May 21, 2023",https://rategain.com/blog/hotel-distribution-channels-guide/,0,The Complete Guide to Distribution Channels in the Hotel Industry
"May 21, 2023",https://rategain.com/blog/unlocking-new-revenue-streams-a-guide-to-effective-channel-management-for-hospitality-businesses/,0,Unlocking New Revenue Streams: A Guide to Effective Channel Management for Hospitality Businesses
"May 21, 2023",https://rategain.com/blog/unveiling-the-magic-of-metasearch-engines/,0,Unveiling the Magic of Metasearch Engines: A Game Changer for Online Businesses
"May 20, 2023",https://rategain.com/blog/content-management-for-hotel-distribution/,0,Where does Content Fit in the Evolution of Hotel Distribution?
"May 19, 2023",https://rategain.com/blog/hotel-content-management-system-for-increased-online-presence/,0,Boost Your Hotel's Online Presence with a Hotel Content Management System
"May 18, 2023",https://rategain.com/blog/streamlining-hotel-pricing-with-rate-shopping-software/,0,Streamline Your Hotel Pricing Strategy with Advanced Rate Shopping Software
"May 18, 2023",https://rategain.com/blog/what-dynamic-pricing-can-do-to-your-hotel-revenue/,5,Dynamic Pricing Strategy in Hotels for Hospitality Industry
"May 18, 2023",https://rategain.com/blog/hotel-pricing-strategy-to-maximize-revenue/,0,Hotel Pricing Strategy: Maximizing Revenue Through Effective Pricing Techniques
"May 18, 2023",https://rategain.com/blog/google-hotel-ads-guide/,0,How To Use Google Hotel Ads: A Complete Guide
"May 16, 2023",https://rategain.com/blog/boost-hotel-revenue-inventory-availability-management/,0,Boost Your Hotel Revenue with Efficient Hotel Inventory Management
"May 16, 2023",https://rategain.com/blog/how-to-benefit-from-hotel-wholesalers/,0,Cracking the Code: How to Benefit from Hotel Wholesalers
"May 15, 2023",https://rategain.com/blog/tips-hotel-manage-rate-parity-issue/,1,8 Easy Tips for Hotel Revenue Managers to Cope With Rate Parity Issues
"May 15, 2023",https://rategain.com/blog/what-is-hotel-rate-parity/,0,What is Hotel Rate Parity? Why is it Important in the Hotel Industry?
"May 14, 2023",https://rategain.com/blog/18-factors-to-consider-before-investing-in-channel-manager-for-your-hotel/,0,18 Factors to Consider before Investing in Channel Manager for Your Hotel
"May 14, 2023",https://rategain.com/blog/hotel-sales-strategies/,0,Crucial Hotel Sales Strategies to Boost Occupancy and Revenue
"July 26, 2016",,0,The sensible economics of 'one to many'
"July 22, 2016",https://rategain.com/blog/5-things-about-hotel-revenue-management-your-boss-wants-to-know-part-i/,0,5 Things About Hotel Revenue Management Your Boss Wants to Know - Part I
"July 12, 2016",https://rategain.com/blog/hotels-improve-your-online-distribution-strategy-with-six-simple-tips/,0,"Hotels, Improve your Online Distribution Strategy with Six Simple Tips"
"July 11, 2016",https://rategain.com/blog/how-to-ensure-the-demand-generated-is-translated-into-increased-revenues/,0,How to Ensure the Demand Generated is Translated into Increased Revenues?
"June 27, 2016",https://rategain.com/blog/brexit-the-impact-on-travel-and-tourism-industry-now-and-later/,0,"Brexit: The Impact on Travel and Tourism Industry, Now and Later"
"June 21, 2016",https://rategain.com/blog/create-a-new-chapter-in-the-relationship-between-your-hotel-guests-with-chat-tools/,0,Create a new chapter in the relationship between Your Hotel & Guests with Chat Tools
"June 19, 2016",,0,Effective Ways to Measure & Generate Demand – Part V
"June 17, 2016",https://rategain.com/blog/effective-ways-to-measure-generate-demand-part-iv/,0,Effective Ways to Measure & Generate Demand – Part IV
"June 15, 2016",https://rategain.com/blog/effective-ways-to-measure-demand-part-ii/,0,Effective Ways to Measure & Generate Demand - Part II
"March 2, 2017",https://rategain.com/blog/hotel-revenue-management-strategy-pre-opening/,0,"Hoteliers, Design Your Revenue Management Strategy in Pre-Opening Stage"
"February 20, 2017",https://rategain.com/blog/track-events-and-holidays-increase-hotel-revenue/,0,"Hoteliers, Keep a Track of Events and Holidays To Increase your Revenue Many Folds"
"February 13, 2017",https://rategain.com/blog/effective-hotel-pricing-strategy-to-boost-revenue/,2,3 Effective Hotel Pricing Strategy Can Boost Your Hotel Revenue
"February 2, 2017",https://rategain.com/blog/how-to-manage-hotel-online-reviews/,0,How to Manage Hotel's Online Reviews & Guest Experience
"January 25, 2017",https://rategain.com/blog/why-should-hotels-pay-special-attention-to-demand-forecasting/,0,Why Should Hotels Pay Special Attention to Demand Forecasting?
"January 16, 2017",,0,"The Brilliant Hotelier: Face to face with Deanna Jayasundera from Theme Resorts and Spas, Sri Lanka"
"January 3, 2017",https://rategain.com/blog/rategains-top-12-blogs-of-2016/,0,RateGain’s Top 12 Blogs of 2016
"December 27, 2016",https://rategain.com/blog/managing-real-time-room-inventories-across-multiple-otas/,0,Managing Real-Time Room Inventories Across Multiple OTAs
"December 19, 2016",https://rategain.com/blog/the-brilliant-hotelier-face-2-face-with-ria-roberto-the-director-of-revenue-management-at-kenz-hotel-management-abu/,0,"The Brilliant Hotelier: Face 2 Face with Ria Roberto, the Director of Revenue Management at Kenz Hotel Management, UAE"
"November 28, 2016",https://rategain.com/blog/be-the-revenue-management-hero-of-your-hotel/,0,Be the Revenue Management Hero of your Hotel
"November 23, 2016",,0,"Hotels, Let’s Go Direct!"
"November 21, 2016",https://rategain.com/blog/tips-to-build-customer-loyalty-for-your-restaurant/,0,Tips to Build Customer Loyalty for Your Restaurant
"November 18, 2016",https://rategain.com/blog/systems-reliability-a-necessity-for-hotel-operations-part-2/,0,"Systems Reliability, A Necessity for Hotel Operations: Part 2"
"November 16, 2016",https://rategain.com/blog/is-your-hotel-united-by-goals-but-divided-by-systems/,0,Is Your Hotel United by Goals but Divided by Systems?
"November 15, 2016",https://rategain.com/blog/the-brilliant-hotelier-face-2-face-with-i-nyoman-astama-general-manager-of-the-bali-niksoma-boutique-beach-resort/,0,"The Brilliant Hotelier: Face 2 Face with I Nyoman Astama, General Manager of the Bali Niksoma Boutique Beach Resort"
"November 11, 2016",https://rategain.com/blog/systems-reliability-a-necessity-for-hotel-operations-part-1/,0,"Systems Reliability, A Necessity for Hotel Operations: Part 1"
"November 8, 2016",https://rategain.com/blog/is-your-hotel-website-ready-for-googles-latest-mobile-updates/,0,Is your Hotel Website Ready for Google's Latest Mobile Updates
"November 3, 2016",https://rategain.com/blog/optimize-your-hotels-seo-and-mobile-strategy/,0,Optimize Your Hotel’s SEO and Mobile Strategy
"November 2, 2016",https://rategain.com/blog/the-brilliant-hotelier-face-2-face-with-stavros-drakou-director-at-cyprotels-hotels-and-resorts-cyprus/,0,"The Brilliant Hotelier: Face 2 Face with Stavros Drakou, Director at Cyprotels Hotels and Resorts, Cyprus"
"October 26, 2016",https://rategain.com/blog/whats-spookier-than-halloween-for-hoteliers/,0,What’s spookier than Halloween for Hoteliers?
"October 10, 2016",,0,Tapping the phenomenal potential of the Asia Pacific region
