Date,Image_URL,Likes_Count,Title
"October 6, 2016",https://rategain.com/blog/the-brilliant-hotelier-face-2-face-with-trisna-widia-marketing-e-commerce-manager-prime-plaza-hotels-and-resorts-indonesia/,0,"The Brilliant Hotelier: Face 2 Face with Trisna Widia, Marketing & E-Commerce Manager, Prime Plaza Hotels and Resorts, Indonesia"
"September 26, 2016",https://rategain.com/blog/how-to-increase-hotel-direct-bookings-dont-ignore-the-role-of-a-booking-engine/,0,How to Increase Hotel Direct Bookings? Don’t Ignore the Role of a Booking Engine
"September 21, 2016",https://rategain.com/blog/weary-of-disruption-5-simple-steps-to-disrupt-the-disruptions-in-the-rapidly-changing-hospitality-industry/,0,Weary of Disruption? 5 Simple Steps to Disrupt the Disruptions in the Rapidly Changing Hospitality Industry
"September 16, 2016",https://rategain.com/blog/disruption-in-the-hotel-industry-and-changing-face-of-the-global-travel-market/,0,Disruption in the Hotel Industry and Changing Face of the Global Travel Market
"September 15, 2016",https://rategain.com/blog/the-brilliant-hotelier-tete-a-tete-with-richard-lewis-the-ceo-of-landmark-hotels-dubai/,0,"The Brilliant Hotelier: Tête-à-Tête with Richard Lewis, the CEO of Landmark Hotels, Dubai"
"September 12, 2016",,0,The fast-changing world of hospitality distribution
"September 6, 2016",https://rategain.com/blog/hotels-are-you-prepared-for-digital-detox-travelers/,0,"Hotels, Are You Prepared for Digital Detox Travelers?"
"September 2, 2016",https://rategain.com/blog/the-brilliant-hotelier-face-2-face-with-the-revenue-director-at-j5-rimal-hotel-apartments-dubai/,0,"The Brilliant Hotelier: Face 2 Face with the Revenue Director at J5 Rimal Hotel Apartments, Dubai"
"September 1, 2016",https://rategain.com/blog/how-hotels-of-tomorrow-are-improving-guest-experience-with-technology/,0,How Hotels of Tomorrow are Improving Guest Experience with Technology?
"August 29, 2016",,0,Sharing economy and alternative lodging offer great opportunities
"August 25, 2016",https://rategain.com/blog/how-can-hotels-generate-more-revenue-from-customer-loyalty-part-ii/,0,How can Hotels Generate More Revenue from Customer Loyalty - Part II
"August 19, 2016",https://rategain.com/blog/how-can-hotels-generate-more-revenue-from-customer-loyalty-part-i/,0,How can Hotels Generate More Revenue from Customer Loyalty - Part I
"August 15, 2016",,0,Travel agents: a re-emerging force in hospitality distribution
"July 28, 2016",https://rategain.com/blog/top-5-things-about-hotel-revenue-management-your-boss-wants-to-know/,0,5 Things About Hotel Revenue Management Your Boss Wants to Know – Part II
"July 26, 2016",,0,Pikachu Conjures his Pokemon Friends for Increasing Hotel Revenues
"May 1, 2023",https://rategain.com/blog/what-is-revpar-why-does-it-matter/,0,What is RevPAR ? Why does it Matter?
"April 30, 2023",https://rategain.com/blog/hotel-marketing-strategy-for-2023/,0,A Complete Guide to Hotel Marketing Strategy for 2023
"April 27, 2023",https://rategain.com/blog/future-of-hospitality-in-latin-america/,0,Latin America’s Hospitality Industry is Ready to Take the AI Leap into the Future
"April 27, 2023",https://rategain.com/blog/sustainable-travel/,0,Sustainability: The Conversation We Need To Have With ChatGPT Today
"April 22, 2023",https://rategain.com/blog/heres-why-you-should-care-about-hotel-content-management-distribution/,4,Here's Why You Should Care About Hotel Content Management & Distribution
"April 15, 2023",https://rategain.com/blog/why-ease-of-use-is-the-core-of-any-booking-engine/,4,Why Ease of Use is the Core of any Booking Engine?
"April 14, 2023",https://rategain.com/blog/why-is-security-critical-for-a-booking-engine/,4,Why is Security Critical for a Booking Engine?
"April 13, 2023",https://rategain.com/blog/thank-you-booking-com-for-showing-us-the-future/,0,Thank You Booking.com For Showing Us The Future
"April 13, 2023",https://rategain.com/blog/how-to-evaluate-a-booking-engine/,3,How to Evaluate a Booking Engine?
"April 12, 2023",https://rategain.com/blog/hotel-booking-engine/,0,All You Need to Know About a Hotel Booking Engine
"April 6, 2023",https://rategain.com/blog/revolutionizing-guest-experiences-and-revenue-management-with-ai/,5,Revolutionizing Guest Experiences and Revenue Management with AI
"April 5, 2023",https://rategain.com/blog/what-is-a-direct-booking/,5,What is Direct Booking?
"April 1, 2023",https://rategain.com/blog/relevance-of-hotel-content/,0,The Relevance of Content for Hotels
"March 21, 2023",https://rategain.com/blog/leading-the-way-top-8-hospitality-technology-trends-to-watch-in-2023/,3,Leading the Way: Top 8 Hospitality Technology Trends to Watch in 2023
"March 21, 2023",https://rategain.com/blog/what-is-hotel-connectivity-distribution-complete-guide/,0,A Complete Guide to Hotel Connectivity & Distribution
"March 16, 2023",https://rategain.com/blog/revolutionizing-the-hospitality-industry-the-role-of-advanced-channel-managers-in-driving-hotel-business-growth/,0,Revolutionizing the Hospitality Industry: The Role of Advanced Channel Managers in Driving Hotel Business Growth
"March 6, 2023",https://rategain.com/blog/what-are-hotel-industry-statistics/,0,What are Hotel Industry Statistics?
"February 15, 2023",https://rategain.com/blog/the-data-goldmine-the-3-step-process-to-unlocking-the-power-of-guest-data/,0,The Data Goldmine: The 3 Step Process to Unlocking the Power of Guest Data
"January 31, 2023",https://rategain.com/blog/how-to-use-guest-messaging-to-improve-revenue/,0,How To Use Guest Messaging To Improve Revenue
"January 30, 2023",https://rategain.com/blog/spin-around-the-challenges-of-an-economic-downturn-with-ai-enabled-solutions/,0,Spin Around the Challenges of an Economic Downturn with AI-Enabled Solutions
"January 23, 2023",https://rategain.com/blog/hotel-property-management-system/,0,What is a Hotel Property Management System (PMS)?
"January 20, 2023",https://rategain.com/blog/unlocking-a-new-level-of-luxury-for-dubai/,0,Unlocking A New Level Of Luxury For Dubai: The Rising Need For Technology
"January 6, 2023",https://rategain.com/blog/troubleshooting-guest-engagement/,1,Troubleshooting Guest Engagement: Is the Answer in the Palm of your Hands?
"December 23, 2022",https://rategain.com/blog/solving-labor-shortage-with-technology-for-guest-engagement/,1,No Shortage of Guest Engagement Despite Labour Shortage in the UK: Why Technology is the Answer
"December 16, 2022",https://rategain.com/blog/journey-to-better-guest-satisfaction-why-digitisation-is-the-shortcut-you-need/,0,Journey to better guest satisfaction: Why digitisation is the shortcut you need
"December 12, 2022",https://rategain.com/blog/tips-for-a-booking-friendly-hotel-website/,1,7 Tips for A Booking-friendly Hotel Website
"December 6, 2022",https://rategain.com/blog/what-the-hotels-of-maldives-need-to-know/,1,The Problem In Paradise: What The Hotels Of Maldives Need To Know
"November 11, 2022",https://rategain.com/blog/ai-to-understand-guest-feelings/,1,The Good Side Of AI: Read Between The Lines To Understand Your Guests’ Feelings
"November 4, 2022",https://rategain.com/blog/preparing-for-the-future-of-air-travel-demand/,0,Preparing for the Future of Air Travel Demand
"November 3, 2022",https://rategain.com/blog/digital-hospitality-no-longer-an-oxymoron/,0,Digital Hospitality: No Longer An Oxymoron
"October 27, 2022",https://rategain.com/blog/peak-experience-for-the-peak-season/,0,Peak Experience For The Peak Season
"October 24, 2022",https://rategain.com/blog/travel-demand-data-report-asia-oct-2022/,0,Forward-looking Insights on Travel Demand: Top Trending Cities in Asia (Oct – Dec 2022)
"October 19, 2022",https://rategain.com/blog/guest-dissatisfaction-de-mystified/,0,Guest Dissatisfaction: De-mystified
"October 11, 2022",https://rategain.com/blog/beyond-just-emojis-leveraging-whatsapp-to-improve-guest-experience/,0,Beyond Just Emojis: Leveraging WhatsApp To Improve Guest Experience
"October 6, 2022",https://rategain.com/blog/experiences-above-all-the-long-and-short-of-guest-experiences/,0,Experiences Above All:  The Long and Short of Guest Experiences
"October 4, 2022",https://rategain.com/blog/humans-of-rategain-mark-haywood/,0,Humans Of RateGain: Q&A With Mark Haywood
"October 3, 2022",https://rategain.com/blog/indias-festive-season-travel-outlook/,0,India’s Festive Season Travel Outlook
"September 27, 2022",https://rategain.com/blog/productivity-for-the-front-desk-what-has-changed/,0,Productivity For The Front Desk: What Has Changed
"September 20, 2022",https://rategain.com/blog/how-can-scoring-content-help-hotels-drive-more-bookings/,0,How Can Scoring Content Help Hotels Drive More Bookings
"September 20, 2022",https://rategain.com/blog/new-data-sources-to-help-commercial-teams-make-better-decisions/,0,New Data Sources To Help Commercial Teams Make Better Decisions
"September 20, 2022",https://rategain.com/blog/hotel-online-bookings-can-be-more-profitable/,0,Hotel Online Bookings Can Be More Profitable
"August 25, 2022",https://rategain.com/blog/bridging-silos-in-commercial-teams-post-pandemic/,4,Bridging Silos in Commercial Teams Post Pandemic
"April 13, 2017",https://rategain.com/blog/managing-seasonal-market-changes-hotel-stays-top-part4/,0,Managing Seasonal Market Changes to Ensure your Hotel Stays on Top - Part 4
"August 25, 2022",https://rategain.com/blog/data-transparency-the-new-way-to-collaborate-in-commercial-teams/,4,Data Transparency: The New Way to Collaborate in Commercial Teams
"April 11, 2017",https://rategain.com/blog/seasonal-market-changes-hotels-attract-guests/,0,Managing Seasonal Market Changes to Ensure your Hotel Stays on Top - Part 3
"July 18, 2022",https://rategain.com/blog/are-middle-east-hoteliers-ready-for-the-next-big-shift/,1,Are Middle East Hoteliers Ready for the Next Big Shift?
"April 7, 2017",https://rategain.com/blog/managing-seasonal-market-changes-hotel-stays-top-part-2/,0,Managing Seasonal Market Changes to Ensure your Hotel Stays on Top - Part 2
"July 13, 2022",https://rategain.com/blog/artificial-intelligence-future-of-hospitality-industry/,2,Artificial Intelligence in the Hospitality Industry : The Future
"April 3, 2017",,0,Solving the hospitality industry’s ‘content conundrum’
"April 3, 2017",https://rategain.com/blog/managing-seasonal-market-changes-hotel-stays-top/,0,Managing Seasonal Market Changes to Ensure your Hotel Stays on Top - Part 1
"March 27, 2017",https://rategain.com/blog/revenue-managers-embrace-automation-market-leaders/,0,"Hoteliers, Beat the Competition and Be The Market Leaders By Adopting Automation"
"March 17, 2017",https://rategain.com/blog/how-hotels-use-google-maximise-online-presence/,0,How Can Hotels Use Google to Maximise their Online Presence?
"March 14, 2017",https://rategain.com/blog/revenue-management-marketing-automation-for-independent-hotels/,0,Revenue Management & Marketing Automation can Help Independent Hotels Stay Ahead
"March 8, 2017",,0,Big Data Challenge
"September 14, 2017",https://rategain.com/blog/yield-management-hospitality-revenue-strategy/,0,Yield Management in Hospitality - Important for Efficient Revenue Management Strategy
"September 7, 2017",https://rategain.com/blog/make-guests-promoters-hotel-brand/,0,What Makes Your Guests The Promoters of Your Brand?
"August 29, 2017",,0,Tapping the potential of IoT
"August 28, 2017",https://rategain.com/blog/role-future-technology-travel-industry/,0,The Role and Future of Technology in Travel Industry
"August 21, 2017",https://rategain.com/blog/brandgain-new-consumer-review-dashboard/,0,New Consumer Review Dashboard For Hotels
"August 21, 2017",https://rategain.com/blog/measuring-hotel-demand-city-skyrocket-revenue/,0,Measuring Demand in Your City will Skyrocket your Revenue - Here is How!
"August 16, 2017",https://rategain.com/blog/methods-gather-hotel-guest-feedback/,0,7 Best Methods to Gather Quality Guest Feedback
"August 14, 2017",https://rategain.com/blog/brilliant-hotelier-thanos-resorts-spas-cyprus/,0,"The Brilliant Hotelier: Face To Face With Panayiotis Kyprianou From Thanos Resorts & Spas, Cyprus"
"August 10, 2017",,0,Monitoring Hundreds of Booking Sites - No Longer a Challenging Task for Hoteliers
"August 8, 2017",https://rategain.com/blog/utilize-closed-user-group-customers-increase-revenue-direct-bookings/,0,"Hotels, Utilize Closed User Group (CUG) Customers to Increase Revenue Through Direct Bookings"
"August 2, 2017",https://rategain.com/blog/revenue-centric-culture-integrated-hotel-technology/,0,Create a Revenue Centric Culture in your Hotel by Integrating Technology
"August 1, 2017",,0,"Despite the best efforts of hotel brands, travelers still love to click around"
"July 31, 2017",https://rategain.com/blog/mobile-support-hotel-online-reputation-management-strategy/,0,"Hoteliers, Are You Using Mobile to Support Your Online Reputation Management?"
"July 25, 2017",https://rategain.com/blog/tips-improve-online-reviews-hotel/,0,7 Practical tips to improve online reviews of your hotel
"July 24, 2017",https://rategain.com/blog/features-consider-choosing-hotel-channel-manager/,0,14 Features to Consider Before Your Hotel Decides to Devote In a Channel Manager
"July 19, 2017",https://rategain.com/blog/managing-hotel-guest-sentiment-online-presence-revenue-centric-culture/,0,Managing Hotel Guest Sentiment and Online Presence to Create Revenue Centric Culture
"July 18, 2017",https://rategain.com/blog/right-hotel-channel-manager-stand-out-competitive-edge/,0,"Hoteliers, You Need a Channel Manager with an Edge to Stand out from Competition"
"July 17, 2017",,0,Blockchain and its potential to upend the travel industry
"July 10, 2017",https://rategain.com/blog/create-hotel-revenue-centric-culture/,0,"Hoteliers, Learn How to Create A Revenue Centric Culture in Your Hotel"
"July 4, 2017",https://rategain.com/blog/growing-importance-hotel-online-reputation-management/,0,"Hoteliers, Learn About The Growing Importance of Hotel Online Reputation Management"
"June 28, 2017",https://rategain.com/blog/restaurant-online-reputation-enhance-hotel-brand/,0,How to Make Restaurant’s Online Reputation a Secret Sauce in Enhancing your Hotel Brand?
"June 19, 2017",https://rategain.com/blog/engaging-travelers-social-media-hotels-reap-benefits/,0,Engaging Travelers Through Social Media Can Reap Umpteen Benefits for Hotels
"June 14, 2017",https://rategain.com/blog/adopt-balanced-hotel-distribution-strategy/,0,Approach For A Balanced Hotel Distribution Strategy - Learn Why Hotels Should Adopt It
"June 6, 2017",https://rategain.com/blog/improve-guest-experience-build-hotel-facebook-strategy-social-media/,0,9 Tips to Build a Hotel’s Facebook Strategy & Improve Guest Experience
"May 30, 2017",https://rategain.com/blog/millennial-travelers-trends-hospitality-sector/,0,Top Trends: Millennial Travelers & the Hospitality Sector
"May 26, 2017",https://rategain.com/blog/evolving-hotel-revenue-manager-use-big-data/,0,Evolving Role Of Hotel Revenue Manager - Part 4
"May 24, 2017",https://rategain.com/blog/evolving-role-revenue-managers-hotel-comp-set/,0,The Evolving Role of Revenue Managers - Part 3
"May 24, 2017",,0,Good translation key to staying in global marketplace
"May 17, 2017",https://rategain.com/blog/evolving-role-hotel-revenue-managers-part2/,0,The Evolving Role Of Hotel Revenue Managers – Part 2
"May 15, 2017",https://rategain.com/blog/revpar-management-hotel-distribution-reputation-strategy/,0,How Your Hotel distribution & Online Reputation Strategy is key to RevPAR Management
"May 10, 2017",https://rategain.com/blog/evolving-role-hotel-revenue-managers-part1/,0,The Evolving Role of Hotel Revenue Managers - Part 1
"May 2, 2017",https://rategain.com/blog/effective-hotels-guest-surveys-loyalty-programs/,0,5 Effective Ways Hotels Could Conduct Guest Surveys and Loyalty Programs
"April 26, 2017",https://rategain.com/blog/vacation-rentals-eating-hotel-revenue/,0,"Hoteliers, Are Vacation Rentals Eating Your Lunch?"
"April 24, 2017",,0,Abbreviations are not a content strategy
"April 18, 2017",https://rategain.com/blog/future-hotel-revenue-management-bots-humans/,0,The Future of Hotel Revenue Management – BOTs or Humans?
"April 14, 2017",https://rategain.com/blog/overcome-shortcomings-challenges-in-online-reputation-management/,0,"Hoteliers, Learn How to Overcome the Challenges in Online Reputation Management"
"July 7, 2022",https://rategain.com/blog/all-about-engage-ai/,2,What is Engage-AI? What are the benefits of using Engage-AI?
"June 30, 2022",https://rategain.com/blog/enjoy-greater-conversions-by-offering-mobile-rates-to-your-prospective-customers/,1,Enjoy Greater Conversions by Offering Mobile Rates to your Prospective Customers
"June 21, 2022",https://rategain.com/blog/improving-business-by-offering-country-rates-to-prospective-customers/,1,Improving Business by Offering Country Rates to Prospective Customers
"May 31, 2022",https://rategain.com/blog/the-role-of-metasearch-in-pandemic-recovery/,0,The Role of Metasearch in Pandemic Recovery
"March 31, 2022",https://rategain.com/blog/dmo-destination-marketing-intelligence-strategy/,0,Why Forward-looking Demand Intelligence is all the More Important for a Destination and it's DMO Today?
"March 10, 2022",https://rategain.com/blog/how-to-become-a-genius-and-drive-up-hotel-visibility-and-occupancy-rates/,0,How to Become a Genius and Drive-up Hotel Visibility and Occupancy Rates!
"March 9, 2022",https://rategain.com/blog/airline-traveller-demand-forecast/,0,Airline Traveler Forecast: Can it help in anticipating demand better?
"January 13, 2022",https://rategain.com/blog/how-can-user-experience-help-revenue-managers/,0,How can User Experience Help Revenue Managers? Ask AirGain
"December 24, 2021",https://rategain.com/blog/the-travel-manifesto-for-2022/,6,The Travel Manifesto for 2022
"October 22, 2021",https://rategain.com/blog/marketing-technology-in-a-data-driven-era/,5,Marketing Technology in a Data-Driven Era
"October 5, 2021",https://rategain.com/blog/usability-and-accessibility-how-they-are-making-airgain-smarter-for-you/,7,Usability and Accessibility – How they are making AirGain smarter for you!
"October 4, 2021",https://rategain.com/blog/building-a-culture-of-empowerment/,5,Building a Culture of Empowerment
"September 29, 2021",https://rategain.com/blog/is-the-future-of-forecasting-clear-for-revenue-managers/,7,Is The Future Of Forecasting Clear For Revenue Managers?
"September 28, 2021",https://rategain.com/blog/directly-manage-rooms-and-rates-from-rategains-channel-manager-ui-to-booking-com/,3,Upcoming Launch: The New Room – Rate Management API will Help Distribution Teams Directly and Quickly Create/Retrieve a Multitude of Room Rate Types from RezGain
"September 23, 2021",https://rategain.com/blog/how-revenue-managers-can-be-future-ready-for-the-next-crisis/,6,How Revenue Managers Can Be Future Ready For The Next Crisis
"September 3, 2021",https://rategain.com/blog/how-can-new-airlines-thrive-the-post-covid-world/,1,How Can New Airlines Thrive the Post- Covid World
"September 1, 2021",https://rategain.com/blog/making-your-hotel-channel-manager-adapt-to-your-day/,1,Making Your Hotel Channel Manager Adapt to Your Day
"September 1, 2021",https://rategain.com/blog/cargain-canvas-analytics-that-give-you-360-degree-control-over-your-market/,0,CarGain Canvas: Analytics that give you 360 degree control over your market
"December 21, 2020",https://rategain.com/blog/some-employees-are-getting-a-new-jobat-their-old-job/,0,Some Employees are Getting a New Job…At Their Old Job
"December 21, 2020",https://rategain.com/blog/visioning-the-post-covid-era-in-revenue-management/,0,Visioning The Post-COVID Era In Revenue Management
"December 21, 2020",https://rategain.com/blog/50-rise-in-bookings-not-enough-for-india-to-catch-up-with-global-recovery/,0,50% Rise in Bookings Not Enough for India to Catch Up With Global Recovery
"December 20, 2020",https://rategain.com/blog/tech-skills-that-can-rebuild-the-travel-industry/,0,Tech Skills That can Rebuild the Travel Industry
"December 18, 2020",https://rategain.com/blog/after-china-can-revenge-travel-happen-in-india/,0,After China can 'Revenge Travel' Happen in India?
"December 16, 2020",https://rategain.com/blog/travel-hospitality-sector-will-take-12-15-months-to-cross-pre-covid-level-hiring-figures-industry-leaders/,0,Travel & Hospitality Sector Will Take 12-15 Months To Cross Pre-covid Level Hiring Figures: Industry Leaders
"December 16, 2020",https://rategain.com/blog/what-hotels-need-to-know-about-the-staycation-boom/,0,What Hotels Need to Know About the Staycation Boom
"December 16, 2020",https://rategain.com/blog/heres-how-hoteliers-can-attract-new-travelers-in-the-post-covid-era/,0,Here’s How Hoteliers Can Attract New Travelers in the Post-COVID Era
"December 15, 2020",https://rategain.com/blog/how-airline-revenue-management-and-pricing-teams-respond-to-revenue-volatility/,0,How Airline Revenue Management and Pricing Teams Respond to Revenue Volatility?
"July 8, 2021",https://rategain.com/blog/what-signals-is-the-summer-of-2021-giving-car-rentals/,0,What Signals is the Summer of 2021 Giving Car Rentals?
"June 25, 2021",https://rategain.com/blog/what-are-your-pronouns/,5,WHAT ARE YOUR PRONOUNS?
"June 15, 2021",https://rategain.com/blog/bringing-more-speed-and-agility-to-airline-pricing-for-the-post-covid-revenue-manager/,1,Bringing More Speed and Agility to Airline Pricing for the Post-COVID Revenue Manager
"May 3, 2021",https://rategain.com/blog/the-current-state-of-airline-pricing-post-covid/,1,The Current State of Airline Pricing post-Covid
"May 3, 2021",https://rategain.com/blog/how-can-hoteliers-get-2021-right-with-a-solid-pricing-strategy-as-volatility-in-recovery-persists/,1,How can hoteliers get 2021 right with a solid pricing strategy as volatility in recovery persists
"April 30, 2021",https://rategain.com/blog/why-we-must-tell-a-visual-data-story/,1,Why We Must Tell a Visual Data Story
"April 29, 2021",https://rategain.com/blog/airlines-revenue-management-checklist-for-2021/,1,Airlines Revenue Management Checklist for 2021
"December 25, 2020",https://rategain.com/blog/cap-on-wedding-guests-might-pinch-but-its-a-necessary-evil/,0,"Cap on Wedding Guests Might Pinch, But It's a Necessary Evil"
"December 22, 2020",https://rategain.com/blog/we-have-been-profitable-since-inception-yogeesh-chandra-global-head-of-corporate-development-rategain/,0,"We have been Profitable Since Inception: Yogeesh Chandra- Global Head of Corporate Development, RateGain"
"November 13, 2017",https://rategain.com/blog/advanced-hotel-revenue-management-tool/,0,Building the Perfect Revenue Strategy Is Not Enough; Advanced Hotel Revenue Management Tool is a Must!
"November 3, 2017",https://rategain.com/blog/geo-based-competitive-price-tracking-rate-intelligence-tool/,0,Travel Industry is Already Using Geo-based Competitive Price Tracking; Act Now Before Its Too Late
"October 25, 2017",https://rategain.com/blog/benefits-hotel-price-intelligence-solution/,0,We Bet You Will Not Want to Miss The Benefits of a Comprehensive Hotel Price Intelligence Solution!
"October 23, 2017",,0,Sharing economy blurring the lines in hospitality
"October 11, 2017",https://rategain.com/blog/track-competitor-mobile-app-rates-hotel/,0,Tracking Mobile App Rates of Your Competition is a MUST for Your Price Strategy!
"September 29, 2017",https://rategain.com/blog/artificial-intelligence-replace-human-intelligence-revenue-management-pricing-analyst/,0,Will Artificial Intelligence Replace Human Intelligence in Revenue Management and Pricing Analysis?
"September 25, 2017",,0,It’s time to reexamine the data structure behind hotel distribution
"September 21, 2017",https://rategain.com/blog/fundamental-hotel-marketing-strategies-stand-out/,1,7 Fundamental Hotel Marketing Strategies To Stand Out From Your Competition
"September 18, 2017",https://rategain.com/blog/effective-hotel-guest-loyalty-program-increase-revenue/,0,Design an Effective Hotel Guest Loyalty Program to Increase Hotel Bookings and Revenue
"December 15, 2020",https://rategain.com/blog/revenue-volatility-in-airlines-is-here-to-stay-what-can-revenue-pricing-teams-do-about-it/,0,Revenue Volatility in Airlines is Here to Stay: What can Revenue & Pricing Teams do About it?
"December 15, 2020",https://rategain.com/blog/these-new-car-rental-subscription-programs-will-get-you-there/,0,These New Car Rental Subscription Programs Will Get You There
"December 12, 2020",https://rategain.com/blog/pardon-me-your-politics-are-showing/,0,"Pardon me, your politics are showing"
"December 12, 2020",https://rategain.com/blog/new-deal-europe-weekly-update-on-tourism-to-the-balkan-region-week-24/,0,"New Deal Europe Weekly Update on Tourism to the Balkan Region, Week 24"
"October 21, 2020",https://rategain.com/blog/see-the-green-shoots-of-recovery-with-smart-distributions-latest-addition-future-demand/,1,See the Green Shoots of Recovery with Smart Distribution’s latest addition “Future Demand”
"October 7, 2020",https://rategain.com/blog/seven-tactics-to-keep-your-hotels-distribution-healthy-and-highly-profitable/,3,Seven Tactics to Keep your Hotel's Distribution Healthy and Highly Profitable
"August 25, 2020",https://rategain.com/blog/bespoke-strategies-for-opening-the-doors-to-the-european-market/,3,Bespoke Strategies for Opening the Doors to the European Market
"August 20, 2020",https://rategain.com/blog/a-new-era-of-exploration-is-coming-to-hoteliers-stay-tuned/,1,A New Era of Exploration is Coming to Hoteliers. Stay Tuned!
"August 14, 2020",https://rategain.com/blog/perspectives-with-saurabh-prakash-how-hotels-can-get-digital-right-for-recovery/,1,Perspectives with Saurabh Prakash: How Hotels Can Get Digital Right for Recovery
"January 20, 2020",https://rategain.com/blog/5-ways-to-ace-hospitality-marketing-in-2020/,1,5 Ways to Ace Hospitality Marketing in 2020
